{
  "schema": "pulsetensor/decision-record/v1",
  "decisionVersion": "1",
  "chainId": 943,
  "taskMarket": "0x1111111111111111111111111111111111111111",
  "taskId": "0xaaaaaaaaaaaaaaaaaaaaaaaaaaaaaaaaaaaaaaaaaaaaaaaaaaaaaaaaaaaaaaaa",
  "taskSpecHash": "0x0505050505050505050505050505050505050505050505050505050505050505",
  "receiptHash": "0x1515151515151515151515151515151515151515151515151515151515151515",
  "assuranceMode": "STATISTICAL",
  "outcome": "FINAL_REJECT",
  "reasonCode": "REJECTED_BY_SNAPSHOTTED_POLICY",
  "bountyVectorId": "REJECTED_REVIEWED_BOUNTY",
  "providerBondVectorId": "VALID_PROVIDER_BOND",
  "providerBondDispositionEvidenceHash": "0x0000000000000000000000000000000000000000000000000000000000000000",
  "evaluatorBondDispositionRoot": "0x0808080808080808080808080808080808080808080808080808080808080808",
  "resolverAuthority": "0x5555555555555555555555555555555555555555",
  "resolverPolicyHash": "0x0909090909090909090909090909090909090909090909090909090909090909",
  "resolverEvidenceHash": "0x1010101010101010101010101010101010101010101010101010101010101010",
  "challengeRecordHash": "0x0000000000000000000000000000000000000000000000000000000000000000",
  "decidedAtBlock": "1250"
}
